{
  "schema_version": "1.0",
  "scope": "offline_synthetic_recipe_lifecycle_inventory",
  "stages": ["source_transform", "template_materialize", "entrypoint_bind", "package_install", "supervised_launch_off", "disable", "upgrade", "rollback", "connected_shadow", "connected_upgrade", "canary_active", "provider_operation", "measured_benefit"],
  "platforms": ["linux", "windows_native", "node"],
  "rows": [
    {
      "id": "python.A",
      "language": "python",
      "recipe": "python.A@1.0",
      "title": "Before tool execution",
      "stages": {
        "source_transform": {"status": "qualified_offline_synthetic", "evidence": ["tests/test_executable_recipes.py", "tests/test_package_lifecycle.py"], "note": "Only the generated module-tail-call-v1 fixture is planned, verified, applied and rolled back. No installed host exists for this recipe."},
        "template_materialize": {"status": "qualified_offline_synthetic", "evidence": ["tests/test_template_catalog.py"], "note": "The archived examples/implementation/a host is rendered to planner inputs; nothing is applied or installed."},
        "entrypoint_bind": {"status": "pending", "evidence": []},
        "package_install": {"status": "pending", "evidence": []},
        "supervised_launch_off": {"status": "pending", "evidence": []},
        "disable": {"status": "pending", "evidence": []},
        "upgrade": {"status": "pending", "evidence": []},
        "rollback": {"status": "pending", "evidence": []},
        "connected_shadow": {"status": "pending", "evidence": []},
        "connected_upgrade": {"status": "pending", "evidence": []},
        "canary_active": {"status": "pending", "evidence": []},
        "provider_operation": {"status": "pending", "evidence": []},
        "measured_benefit": {"status": "pending", "evidence": []}
      },
      "platforms": {
        "linux": {"status": "qualified_offline_synthetic", "stages": ["source_transform", "template_materialize"], "evidence": ["tests/test_executable_recipes.py", "tests/test_package_lifecycle.py", "tests/test_template_catalog.py"], "note": "Ungated fixture tests; the hosted full suite runs on Linux."},
        "windows_native": {"status": "pending", "stages": [], "evidence": [], "note": "The transform tests are not platform gated, but the hosted native Windows jobs run only the named Windows modules, whose fixture is recipe C. No native Windows run is recorded for this recipe."},
        "node": {"status": "not_applicable", "stages": [], "evidence": [], "note": "Python recipe; the Node backend has its own row."}
      }
    },
    {
      "id": "python.B",
      "language": "python",
      "recipe": "python.B@1.0",
      "title": "Expensive or irreversible action",
      "stages": {
        "source_transform": {"status": "qualified_offline_synthetic", "evidence": ["tests/test_executable_recipes.py", "tests/test_package_lifecycle.py"], "note": "Only the generated module-tail-call-v1 fixture is planned, verified, applied and rolled back. No installed host exists for this recipe."},
        "template_materialize": {"status": "pending", "evidence": []},
        "entrypoint_bind": {"status": "pending", "evidence": []},
        "package_install": {"status": "pending", "evidence": []},
        "supervised_launch_off": {"status": "pending", "evidence": []},
        "disable": {"status": "pending", "evidence": []},
        "upgrade": {"status": "pending", "evidence": []},
        "rollback": {"status": "pending", "evidence": []},
        "connected_shadow": {"status": "pending", "evidence": []},
        "connected_upgrade": {"status": "pending", "evidence": []},
        "canary_active": {"status": "pending", "evidence": []},
        "provider_operation": {"status": "pending", "evidence": []},
        "measured_benefit": {"status": "pending", "evidence": []}
      },
      "platforms": {
        "linux": {"status": "qualified_offline_synthetic", "stages": ["source_transform"], "evidence": ["tests/test_executable_recipes.py", "tests/test_package_lifecycle.py"], "note": "Ungated fixture tests; the hosted full suite runs on Linux."},
        "windows_native": {"status": "pending", "stages": [], "evidence": [], "note": "The transform tests are not platform gated, but the hosted native Windows jobs run only the named Windows modules, whose fixture is recipe C. No native Windows run is recorded for this recipe."},
        "node": {"status": "not_applicable", "stages": [], "evidence": [], "note": "Python recipe; the Node backend has its own row."}
      }
    },
    {
      "id": "python.C",
      "language": "python",
      "recipe": "python.C@1.0",
      "title": "Registered tool routing",
      "stages": {
        "source_transform": {"status": "qualified_offline_synthetic", "evidence": ["tests/test_executable_recipes.py", "tests/test_package_lifecycle.py", "tests/test_template_python_entrypoint.py"]},
        "template_materialize": {"status": "qualified_offline_synthetic", "evidence": ["tests/test_template_catalog.py"]},
        "entrypoint_bind": {"status": "qualified_offline_synthetic", "evidence": ["tests/test_template_python_entrypoint.py"]},
        "package_install": {"status": "qualified_offline_synthetic", "evidence": ["tests/test_template_installation.py"]},
        "supervised_launch_off": {"status": "qualified_offline_synthetic", "evidence": ["tests/test_template_delivery_installed.py"]},
        "disable": {"status": "qualified_offline_synthetic", "evidence": ["tests/test_template_delivery_installed.py"]},
        "upgrade": {"status": "qualified_offline_synthetic", "evidence": ["tests/test_template_delivery_installed.py"]},
        "rollback": {"status": "qualified_offline_synthetic", "evidence": ["tests/test_template_delivery_installed.py"]},
        "connected_shadow": {"status": "qualified_offline_synthetic", "evidence": ["tests/test_connected_installed_binding.py"], "note": "Independent Alpha 1.0.2 host with a local synthetic TLS protocol. The use-case C source contract (examples/coding-agent/agent.py) is a different host and stays pending in the use-case matrix."},
        "connected_upgrade": {"status": "implemented_unqualified", "evidence": ["tests/test_connected_generation_installed.py"], "note": "A stopped generation transfer driver exists for the Alpha host. The changelog and use-case matrix keep connected upgrade pending, so no qualification is claimed here."},
        "canary_active": {"status": "pending", "evidence": []},
        "provider_operation": {"status": "pending", "evidence": []},
        "measured_benefit": {"status": "pending", "evidence": []}
      },
      "platforms": {
        "linux": {"status": "qualified_offline_synthetic", "stages": ["source_transform", "template_materialize", "entrypoint_bind", "package_install", "supervised_launch_off", "disable", "upgrade", "rollback", "connected_shadow"], "evidence": ["tests/test_connected_installed_binding.py", "tests/test_executable_recipes.py", "tests/test_package_lifecycle.py", "tests/test_template_catalog.py", "tests/test_template_delivery_installed.py", "tests/test_template_installation.py", "tests/test_template_python_entrypoint.py"], "note": "Installed stages require Linux x86-64 CPython 3.13 and an explicit offline wheelhouse; without that input the cited installed cases skip."},
        "windows_native": {"status": "qualified_offline_synthetic", "stages": ["source_transform", "template_materialize", "entrypoint_bind", "package_install", "supervised_launch_off", "upgrade", "rollback"], "evidence": ["tests/test_windows_source_mutation.py", "tests/test_windows_template_delivery.py", "tests/test_windows_template_run.py"], "note": "Separate native NTFS off-mode API checkpoint with its own package, install, Job Object session and retained-generation selection. Durable disable and the #55/#56 Linux contracts are not covered; native connected shadow (tests/test_windows_template_connected.py) remains pending qualification."},
        "node": {"status": "not_applicable", "stages": [], "evidence": [], "note": "Python recipe; the Node backend has its own row."}
      }
    },
    {
      "id": "python.D",
      "language": "python",
      "recipe": "python.D@1.0",
      "title": "Retrieval to generation",
      "stages": {
        "source_transform": {"status": "qualified_offline_synthetic", "evidence": ["tests/test_executable_recipes.py", "tests/test_package_lifecycle.py", "tests/test_use_case_retrieval_host.py"]},
        "template_materialize": {"status": "qualified_offline_synthetic", "evidence": ["tests/test_use_case_retrieval_host.py"]},
        "entrypoint_bind": {"status": "qualified_offline_synthetic", "evidence": ["tests/test_use_case_retrieval_bind.py"]},
        "package_install": {"status": "qualified_offline_synthetic", "evidence": ["tests/test_use_case_retrieval_bound_installed.py", "tests/test_use_case_retrieval_host.py"]},
        "supervised_launch_off": {"status": "qualified_offline_synthetic", "evidence": ["tests/test_use_case_retrieval_bound_installed.py", "tests/test_use_case_retrieval_host.py"]},
        "disable": {"status": "qualified_offline_synthetic", "evidence": ["tests/test_use_case_retrieval_bound_installed.py", "tests/test_use_case_retrieval_host.py"]},
        "upgrade": {"status": "qualified_offline_synthetic", "evidence": ["tests/test_use_case_retrieval_bound_installed.py", "tests/test_use_case_retrieval_host.py"]},
        "rollback": {"status": "qualified_offline_synthetic", "evidence": ["tests/test_use_case_retrieval_bound_installed.py", "tests/test_use_case_retrieval_host.py"]},
        "connected_shadow": {"status": "qualified_offline_synthetic", "evidence": ["tests/test_use_case_retrieval_connected.py"]},